[
  {
    "id": "pescy",
    "name": "Pescy",
    "texture": "player_pescy",
    "offset": {
      "x": 0.0,
      "y": 16.0
    }
  },
  {
    "id": "sharky",
    "name": "Sharky",
    "texture": "player_sharky",
    "offset": {
      "x": 0.0,
      "y": 16.0
    }
  },
  {
    "id": "fishy",
    "name": "Fishy",
    "texture": "player_fishy",
    "offset": {
      "x": 0.0,
      "y": 16.0
    }
  },
  {
    "id": "orcy",
    "name": "Orcy",
    "texture": "player_orcy",
    "offset": {
      "x": 0.0,
      "y": 16.0
    }
  },
  {
    "id": "lionfishy",
    "name": "Lionfishy",
    "texture": "player_lionfishy",
    "offset": {
      "x": 0.0,
      "y": 16.0
    }
  },
  {
    "id": "catty",
    "name": "Catty",
    "texture": "player_catty",
    "offset": {
      "x": 0.0,
      "y": 16.0
    }
  }
]
